4835890,5,,098-903,098903,98903,0.1281,276992615,149,Pringle-Morse Cons ISD,Pringle-Morse Cons,Pringle-Morse Consolidated Independent School District,4835890,UNCATEGORIZED,,35890
4835910,4,,108-910,108910,108910,0.4518,19227804736,462,Progreso ISD,Progreso,Progreso Independent School District,4835910,CORPUS CHRISTI,,35910
4836000,5,,043-912,043912,43912,0.5,391126401,1004,Prosper ISD,Prosper,Prosper Independent School District,4836000,DFW,,36000
4836180,2,,099-903,099903,99903,0,566537196,101,Quanah ISD,Quanah,Quanah Independent School District,4836180,DFW,,36180
4836210,3,,034-907,034907,34907,0.0487,1624181217,667,Queen City ISD,Queen City,Queen City Independent School District,4836210,DFW,,36210
4836240,5,,116-908,116908,116908,0.1,652069269,839,Quinlan ISD,Quinlan,Quinlan Independent School District,4836240,DFW,,36240
4836300,4,,250-904,250904,250904,0.1414,946814118,618,Quitman ISD,Quitman,Quitman Independent School District,4836300,DFW,,36300
4836360,4,,190-903,190903,190903,0.0874,127351843,617,Rains ISD,Rains,Rains Independent School District,4836360,DFW,,36360
4836390,7,,054-903,054903,54903,0,30467609,733,Ralls ISD,Ralls,Ralls Independent School District,4836390,DFW - LUBBOCK,,36390
4836420,7,,066-005,066005,66005,0,192625868,150,Ramirez CSD,Ramirez CSD,Ramirez Common School District,4836420,CORPUS CHRISTI,,36420
4836450,1,,015-906,015906,15906,0,0,913,Randolph Field ISD,Randolph Field,Randolph Field Independent School District,4836450,UNCATEGORIZED,,36450
4836480,7,P,067-907,067907,67907,0.35,432886521,496,Ranger ISD,Ranger,Ranger Independent School District,4836480,AUSTIN,,36480
4836510,1,,231-902,231902,231902,0.1866,426302782,595,Rankin ISD,Rankin,Rankin Independent School District,4836510,UNCATEGORIZED,,36510
4836540,5,,245-903,245903,245903,0.1593,8683700933,471,Raymondville ISD,Raymondville,Raymondville Independent School District,4836540,CORPUS CHRISTI,,36540
4836570,3,,192-901,192901,192901,0.12,265872284,594,Reagan County ISD,Reagan County,Reagan County Independent School District,4836570,UNCATEGORIZED,,36570
4836630,7,,019-911,019911,19911,0.2356,3581097693,566,Red Lick ISD,Red Lick,Red Lick Independent School District,4836630,DFW,,36630
4836660,7,,070-911,070911,70911,0.3481,308979656,118,Red Oak ISD,Red Oak,Red Oak Independent School District,4836660,DFW,,36660
4836750,1,,019-906,019906,19906,0.1785,448694175,668,Redwater ISD,Redwater,Redwater Independent School District,4836750,DFW,,36750
4836780,5,,196-903,196903,196903,0.29,227709791,211,Refugio ISD,Refugio,Refugio Independent School District,4836780,CORPUS CHRISTI,,36780
4836930,7,,137-902,137902,137902,0,1004759958,425,Ricardo ISD,Ricardo,Ricardo Independent School District,4836930,CORPUS CHRISTI,,36930
4836960,1,,175-911,175911,175911,0.4097,260376173,292,Rice ISD,Rice,Rice Independent School District,4836960,DFW,,36960
4836970,7,,045-903,045903,45903,0.4097,260376173,199,Rice Cons ISD,Rice Cons,Rice Consolidated Independent School District,4836970,DFW,,36970
4836990,1,,093-905,093905,93905,0.35,125308986,222,Richards ISD,Richards,Richards Independent School District,4836990,DFW,,36990
4837020,7,,057-916,057916,57916,0.35,125308986,974,Richardson ISD,Richardson,Richardson Independent School District,4837020,DFW,,37020
4837080,1,,206-902,206902,206902,0.4,87974658,107,Richland Springs ISD,Richland Springs,Richland Springs Independent School District,4837080,HOUSTON,,37080
4837110,7,,161-912,161912,161912,0.3791,1720054641,790,Riesel ISD,Riesel,Riesel Independent School District,4837110,AUSTIN,,37110
4837140,5,,214-901,214901,214901,0,0,927,Rio Grande City Grulla ISD,Rio Grande City Grulla,Rio Grande City Grulla Independent School District,4837140,UNCATEGORIZED,,37140
4837170,5,p,031-911,031911,31911,0.26,343784324,409,Rio Hondo ISD,Rio Hondo,Rio Hondo Independent School District,4837170,SAN ANTONIO,,37170
4837200,3,,126-907,126907,126907,0.3557,71551237,434,Rio Vista ISD,Rio Vista,Rio Vista Independent School District,4837200,DFW,,37200
4837230,7,,067-908,067908,67908,0,315993209,81,Rising Star ISD,Rising Star,Rising Star Independent School District,4837230,AUSTIN,,37230
4837260,3,,188-902,188902,188902,0.26,318162967,129,River Road ISD,River Road,River Road Independent School District,4837260,UNCATEGORIZED,,37260
4837320,5,,137-903,137903,137903,0,351759473,229,Riviera ISD,Riviera,Riviera Independent School District,4837320,CORPUS CHRISTI,,37320
4837380,1,,041-902,041902,41902,0.42,990941167,288,Robert Lee ISD,Robert Lee,Robert Lee Independent School District,4837380,UNCATEGORIZED,,37380
4837410,2,,161-922,161922,161922,0.1814,778281291,831,Robinson ISD,Robinson,Robinson Independent School District,4837410,AUSTIN,,37410
4837440,1,,178-909,178909,178909,0.52,275379290,114,Robstown ISD,Robstown,Robstown Independent School District,4837440,CORPUS CHRISTI,,37440
4837470,2,,076-903,076903,76903,0.285,170733113,302,Roby Cons ISD,Roby Cons,Roby Consolidated Independent School District,4837470,DFW - LUBBOCK,,37470
4837500,6,,160-904,160904,160904,0,759643818,326,Rochelle ISD,Rochelle,Rochelle Independent School District,4837500,AUSTIN,,37500
4837590,1,,166-904,166904,166904,0.3619,4788549058,625,Rockdale ISD,Rockdale,Rockdale Independent School District,4837590,AUSTIN,,37590
4837650,7,,199-901,199901,199901,0.36,280502888,841,Rockwall ISD,Rockwall,Rockwall Independent School District,4837650,DFW,,37650
4837710,7,,014-907,014907,14907,0.3934,817048859,645,Rogers ISD,Rogers,Rogers Independent School District,4837710,AUSTIN,,37710
4837740,1,,214-903,214903,214903,0.3816,306864152,925,Roma ISD,Roma,Roma Independent School District,4837740,CORPUS CHRISTI,,37740
4837800,3,,152-908,152908,152908,0.19,204159714,739,Roosevelt ISD,Roosevelt,Roosevelt Independent School District,4837800,DFW - LUBBOCK,,37800
4837830,2,,110-905,110905,110905,0.3447,375464251,57,Ropes ISD,Ropes,Ropes Independent School District,4837830,DFW - LUBBOCK,,37830
4837860,1,,177-901,177901,177901,0.0507,379423662,361,Roscoe Collegiate ISD,Roscoe Collegiate,Roscoe Collegiate Independent School District,4837860,DFW - LUBBOCK,,37860
4837900,5,,073-905,073905,73905,0.2345,457137122,772,Rosebud-Lott ISD,Rosebud-Lott,Rosebud-Lott Independent School District,4837900,AUSTIN,,37900
4838040,7,,076-904,076904,76904,0.275,53169724991,362,Rotan ISD,Rotan,Rotan Independent School District,4838040,DFW - LUBBOCK,,38040
4838080,4,P,246-909,246909,246909,0.208,784656024,979,Round Rock ISD,Round Rock,Round Rock Independent School District,4838080,AUSTIN,,38080
4838100,4,,075-908,075908,75908,0.041,3446296673,140,Round Top-Carmine ISD,Round Top-Carmine,Round Top-Carmine Independent School District,4838100,AUSTIN,,38100
4838190,6,,237-905,237905,237905,0.3588,4503406364,551,Royal ISD,Royal,Royal Independent School District,4838190,HOUSTON,,38190
4838220,3,,199-902,199902,199902,0.5,108672821,838,Royse City ISD,Royse City,Royse City Independent School District,4838220,DFW,,38220
4838280,4,,104-903,104903,104903,0,710096877,314,Rule ISD,Rule,Rule Independent School District,4838280,UNCATEGORIZED,,38280
4838310,1,,128-903,128903,128903,0.45,544700809,541,Runge ISD,Runge,Runge Independent School District,4838310,SAN ANTONIO,,38310
4838360,6,,037-907,037907,37907,0.32,211961710,311,Rusk ISD,Rusk,Rusk Independent School District,4838360,DFW,,38360
4838400,3,,091-914,091914,91914,0.283,585425550,804,S and S Cons ISD,S and S Cons,S and S Consolidated Independent School District,4838400,DFW,,38400
4838430,1,c,232-902,232902,232902,0.0867,524772747,324,Sabinal ISD,Sabinal,Sabinal Independent School District,4838430,SAN ANTONIO,2,38430
4838460,4,,092-906,092906,92906,0.2833,233870815,718,Sabine ISD,Sabine,Sabine Independent School District,4838460,HOUSTON,,38460
4838490,7,,123-913,123913,123913,0.2833,233870815,1,Sabine Pass ISD,Sabine Pass,Sabine Pass Independent School District,4838490,HOUSTON,,38490
4838520,4,,169-911,169911,169911,0.27,1706863059,369,Saint Jo ISD,Saint Jo,Saint Jo Independent School District,4838520,DFW,,38520
4838580,6,P,014-908,014908,14908,0.5,160848911,635,Salado ISD,Salado,Salado Independent School District,4838580,AUSTIN,,38580
4838610,4,,112-909,112909,112909,0,232879864,33,Saltillo ISD,Saltillo,Saltillo Independent School District,4838610,DFW,,38610
4838640,6,,074-917,074917,74917,0.163,6691880272,7,Sam Rayburn ISD,Sam Rayburn,Sam Rayburn Independent School District,4838640,DFW,,38640
4838700,2,,226-903,226903,226903,0.1174,26373659730,285,San Angelo ISD,San Angelo,San Angelo Independent School District,4838700,UNCATEGORIZED,,38700
4838730,4,c,015-907,015907,15907,0.4812,935639850,921,San Antonio ISD,San Antonio,San Antonio Independent School District,4838730,SAN ANTONIO,3,38730
4838760,2,,203-901,203901,203901,0.0738,235190870,810,San Augustine ISD,San Augustine,San Augustine Independent School District,4838760,AUSTIN,,38760
4838790,3,,031-912,031912,31912,0.2799,461670257,354,San Benito Cons ISD,San Benito Cons,San Benito Consolidated Independent School District,4838790,CORPUS CHRISTI,,38790
4838820,7,,066-902,066902,66902,0.4302,287571703,72,San Diego ISD,San Diego,San Diego Independent School District,4838820,CORPUS CHRISTI,,38820
4838850,2,,071-904,071904,71904,0.1497,2855198824,1010,San Elizario ISD,San Elizario,San Elizario Independent School District,4838850,UNCATEGORIZED,,38850
4838900,7,,233-901,233901,233901,0.1771,157935718,304,San Felipe-Del Rio Cons ISD,San Felipe-Del Rio Cons,San Felipe-Del Rio Consolidated Independent School District,4838900,UNCATEGORIZED,,38900
4838910,2,,214-902,214902,214902,0,9698475231,928,San Isidro ISD,San Isidro,San Isidro Independent School District,4838910,CORPUS CHRISTI,,38910
4838970,4,p,105-902,105902,105902,0.2691,191418364,100,San Marcos Cons ISD,San Marcos Cons,San Marcos Consolidated Independent School District,4838970,SAN ANTONIO,,38970
4839000,2,,245-904,245904,245904,0.16,549550621,31,San Perlita ISD,San Perlita,San Perlita Independent School District,4839000,CORPUS CHRISTI,,39000
4839030,3,,206-901,206901,206901,0.06,9726016,647,San Saba ISD,San Saba,San Saba Independent School District,4839030,AUSTIN,,39030
4839060,3,,022-903,022903,22903,0,4606847919,151,San Vicente ISD,San Vicente,San Vicente Independent School District,4839060,UNCATEGORIZED,,39060
4839120,5,,058-909,058909,58909,0,139164092,482,Sands Cons ISD,Sands Cons,Sands Consolidated Independent School District,4839120,DFW - LUBBOCK,,39120
4839150,6,,117-903,117903,117903,0.27,2113918452,953,Sanford-Fritch ISD,Sanford-Fritch,Sanford-Fritch Independent School District,4839150,UNCATEGORIZED,,39150
4839180,6,,061-908,061908,61908,0.476,132442117,698,Sanger ISD,Sanger,Sanger Independent School District,4839180,DFW,,39180
4839210,1,,042-903,042903,42903,0.5,3242357929,397,Santa Anna ISD,Santa Anna,Santa Anna Independent School District,4839210,DFW,,39210
4839270,3,,084-909,084909,84909,0.3623,119017002,572,Santa Fe ISD,Santa Fe,Santa Fe Independent School District,4839270,HOUSTON,,39270
4839300,3,,137-904,137904,137904,0.2895,95456464,426,Santa Gertrudis ISD,Santa Gertrudis,Santa Gertrudis Independent School District,4839300,CORPUS CHRISTI,,39300
4839330,1,,031-913,031913,31913,0.485,149721419,490,Santa Maria ISD,Santa Maria,Santa Maria Independent School District,4839330,CORPUS CHRISTI,,39330
4839360,3,,031-914,031914,31914,0.4005,531251137,410,Santa Rosa ISD,Santa Rosa,Santa Rosa Independent School District,4839360,CORPUS CHRISTI,,39360
4839390,4,p,182-904,182904,182904,0.1642,1379933110,208,Santo ISD,Santo,Santo Independent School District,4839390,SAN ANTONIO,,39390
4839450,1,,074-911,074911,74911,0.1274,7108112275,681,Savoy ISD,Savoy,Savoy Independent School District,4839450,DFW,,39450
4839480,7,p,094-902,094902,94902,0.47,453325422,914,Schertz-Cibolo-Universal City ISD,Schertz-Cibolo-Universal City,Schertz-Cibolo-Universal City Independent School District,4839480,SAN ANTONIO,,39480
4839510,7,,207-901,207901,207901,0,591391745,439,Schleicher ISD,Schleicher,Schleicher Independent School District,4839510,AUSTIN,,39510
4839540,7,,075-903,075903,75903,0.1747,446639793,139,Schulenburg ISD,Schulenburg,Schulenburg Independent School District,4839540,AUSTIN,,39540
4839570,6,,129-910,129910,129910,0.16,241366457,393,Scurry-Rosser ISD,Scurry-Rosser,Scurry-Rosser Independent School District,4839570,DFW,,39570
4839600,1,,083-901,083901,83901,0.3527,1905061028,58,Seagraves ISD,Seagraves,Seagraves Independent School District,4839600,DFW - LUBBOCK,,39600
4839630,1,,008-902,008902,8902,0.2661,4600291406,552,Sealy ISD,Sealy,Sealy Independent School District,4839630,HOUSTON,,39630
4839690,7,c,094-901,094901,94901,0.385,4746178915,947,Seguin ISD,Seguin,Seguin Independent School District,4839690,SAN ANTONIO,1,39690
4839750,2,,083-903,083903,83903,0.13,536886251,335,Seminole ISD,Seminole,Seminole Independent School District,4839750,DFW - LUBBOCK,,39750
4839780,7,,012-901,012901,12901,0.08,495830569,584,Seymour ISD,Seymour,Seymour Independent School District,4839780,DFW,,39780
4839870,3,,152-909,152909,152909,0.5,149269574,264,Shallowater ISD,Shallowater,Shallowater Independent School District,4839870,DFW - LUBBOCK,,39870
4839900,1,,242-902,242902,242902,0,4180034119,456,Shamrock ISD,Shamrock,Shamrock Independent School District,4839900,UNCATEGORIZED,,39900
4839930,6,,108-911,108911,108911,0.1805,446295253,298,Sharyland ISD,Sharyland,Sharyland Independent School District,4839930,CORPUS CHRISTI,,39930
4839960,5,,210-903,210903,210903,0.0539,7045330771,260,Shelbyville ISD,Shelbyville,Shelbyville Independent School District,4839960,DFW,,39960
4839990,5,,101-924,101924,101924,0.46,582386565,10,Sheldon ISD,Sheldon,Sheldon Independent School District,4839990,HOUSTON,,39990
4840020,3,,204-904,204904,204904,0.2127,5205942873,936,Shepherd ISD,Shepherd,Shepherd Independent School District,4840020,HOUSTON,,40020
4840080,4,,091-906,091906,91906,0.479,1244840340,728,Sherman ISD,Sherman,Sherman Independent School District,4840080,DFW,,40080
4840110,2,,143-903,143903,143903,0.0713,51532589,764,Shiner ISD,Shiner,Shiner Independent School District,4840110,SAN ANTONIO,,40110
4840170,4,,047-905,047905,47905,0.09,185545611,345,Sidney ISD,Sidney,Sidney Independent School District,4840170,AUSTIN,,40170
4840200,4,,115-902,115902,115902,0.41,1179069084,164,Sierra Blanca ISD,Sierra Blanca,Sierra Blanca Independent School District,4840200,UNCATEGORIZED,,40200
4840230,5,,100-904,100904,100904,0.3113,210437821,964,Silsbee ISD,Silsbee,Silsbee Independent School District,4840230,HOUSTON,,40230
4840290,3,,023-902,023902,23902,0.3,141619071,49,Silverton ISD,Silverton,Silverton Independent School District,4840290,DFW - LUBBOCK,,40290
4840320,2,,019-909,019909,19909,0,1599707233,664,Simms ISD,Simms,Simms Independent School District,4840320,DFW,,40320
4840350,1,,205-906,205906,205906,0.48,269208275,270,Sinton ISD,Sinton,Sinton Independent School District,4840350,CORPUS CHRISTI,,40350
4840380,3,,049-909,049909,49909,0,292040657,504,Sivells Bend ISD,Sivells Bend,Sivells Bend Independent School District,4840380,DFW,,40380
4840410,5,,013-905,013905,13905,0.437,524489360,181,Skidmore-Tynan ISD,Skidmore-Tynan,Skidmore-Tynan Independent School District,4840410,CORPUS CHRISTI,,40410
4840440,6,,152-903,152903,152903,0.4194,440404691,735,Slaton ISD,Slaton,Slaton Independent School District,4840440,DFW - LUBBOCK,,40440
4840470,7,,249-908,249908,249908,0.084,150809631,503,Slidell ISD,Slidell,Slidell Independent School District,4840470,DFW,,40470
4840500,5,,001-909,001909,1909,0.1587,1432131188,533,Slocum ISD,Slocum,Slocum Independent School District,4840500,DFW,,40500
4840550,7,,011-904,011904,11904,0.16,142156552,768,Smithville ISD,Smithville,Smithville Independent School District,4840550,AUSTIN,,40550
4840590,7,,110-906,110906,110906,0,457664901,65,Smyer ISD,Smyer,Smyer Independent School District,4840590,DFW - LUBBOCK,,40590
4840620,4,,026-903,026903,26903,0.25,2758775477,638,Snook ISD,Snook,Snook Independent School District,4840620,AUSTIN,,40620
4840650,5,,208-902,208902,208902,0.063,14025036146,262,Snyder ISD,Snyder,Snyder Independent School District,4840650,DFW - LUBBOCK,,40650
4840680,2,c,015-908,015908,15908,0.4812,935639850,900,South San Antonio ISD,South San Antonio,South San Antonio Independent School District,4840680,SAN ANTONIO,3,40680
4840710,4,,071-909,071909,71909,0.3951,849743265,1006,Socorro ISD,Socorro,Socorro Independent School District,4840710,UNCATEGORIZED,,40710
4840740,3,p,015-909,015909,15909,0.3203,493850085,895,Somerset ISD,Somerset,Somerset Independent School District,4840740,SAN ANTONIO,,40740
4840770,5,,026-902,026902,26902,0.21,731151439,301,Somerville ISD,Somerville,Somerville Independent School District,4840770,AUSTIN,,40770
4840800,1,,218-901,218901,218901,0.0525,2544034082,347,Sonora ISD,Sonora,Sonora Independent School District,4840800,SAN ANTONIO,,40800
4840890,3,,085-903,085903,85903,0,2131228690,737,Southland ISD,Southland,Southland Independent School District,4840890,DFW - LUBBOCK,,40890
4840920,2,p,015-917,015917,15917,0.3288,6498102050,897,Southside ISD,Southside,Southside Independent School District,4840920,SAN ANTONIO,,40920
4840950,1,c,015-912,015912,15912,0.4281,403877188,893,Southwest ISD,Southwest,Southwest Independent School District,4840950,SAN ANTONIO,2,40950
4841010,1,,098-904,098904,98904,0.1897,1714240928,22,Spearman ISD,Spearman,Spearman Independent School District,4841010,UNCATEGORIZED,,41010
4841070,2,,170-907,170907,170907,0.4452,43166399291,240,Splendora ISD,Splendora,Splendora Independent School District,4841070,HOUSTON,,41070
4841100,7,,101-920,101920,101920,0.3045,47423450,73,Spring Branch ISD,Spring Branch,Spring Branch Independent School District,4841100,HOUSTON,,41100
4841190,4,,092-907,092907,92907,0.4,87974658,384,Spring Hill ISD,Spring Hill,Spring Hill Independent School District,4841190,HOUSTON,,41190
4841220,7,,101-919,101919,101919,0.3045,47423450,74,Spring ISD,Spring,Spring Independent School District,4841220,HOUSTON,,41220
4841250,7,,140-907,140907,140907,0.4,87974658,457,Springlake-Earth ISD,Springlake-Earth,Springlake-Earth Independent School District,4841250,HOUSTON,,41250
4841280,7,,184-902,184902,184902,0.4,87974658,863,Springtown ISD,Springtown,Springtown Independent School District,4841280,HOUSTON,,41280
4841340,2,,229-905,229905,229905,0.3346,95050194,909,Spurger ISD,Spurger,Spurger Independent School District,4841340,DFW - LUBBOCK,,41340
4841350,6,,079-910,079910,79910,0.2447,111705236,886,Stafford MSD,Stafford MSD,Stafford Municipal School District,4841350,HOUSTON,,41350
4841400,5,,127-906,127906,127906,0.29,8156293561,315,Stamford ISD,Stamford,Stamford Independent School District,4841400,UNCATEGORIZED,,41400
4841430,7,,156-902,156902,156902,0,91627995,596,Stanton ISD,Stanton,Stanton Independent School District,4841430,DFW - LUBBOCK,,41430
4841520,1,,072-903,072903,72903,0.2828,984848028,630,Stephenville ISD,Stephenville,Stephenville Independent School District,4841520,DFW,,41520
4841550,2,,216-901,216901,216901,0.2398,318271645,60,Sterling City ISD,Sterling City,Sterling City Independent School District,4841550,UNCATEGORIZED,,41550
4841580,3,,117-904,117904,117904,0.2783,6062519516,956,Plemons-Stinnett-Phillips Cons ISD,Plemons-Stinnett-Phillips Cons,Plemons-Stinnett-Phillips Consolidated Independent School District,4841580,UNCATEGORIZED,,41580
4841610,6,p,247-906,247906,247906,0.3076,581292443,950,Stockdale ISD,Stockdale,Stockdale Independent School District,4841610,SAN ANTONIO,,41610
4841670,1,,211-902,211902,211902,0.1516,81943315,579,Stratford ISD,Stratford,Stratford Independent School District,4841670,UNCATEGORIZED,,41670
4841700,5,,182-905,182905,182905,0,644662980,214,Strawn ISD,Strawn,Strawn Independent School District,4841700,DFW,,41700
4841760,1,,140-908,140908,140908,0.135,131153155,436,Sudan ISD,Sudan,Sudan Independent School District,4841760,DFW - LUBBOCK,,41760
4841790,3,,112-910,112910,112910,0.07,2029198728,380,Sulphur Bluff ISD,Sulphur Bluff,Sulphur Bluff Independent School District,4841790,DFW,,41790
4841820,2,,112-901,112901,112901,0.4,87974658,121,Sulphur Springs ISD,Sulphur Springs,Sulphur Springs Independent School District,4841820,HOUSTON,,41820
4841850,2,,110-907,110907,110907,0.1,1845678359,66,Sundown ISD,Sundown,Sundown Independent School District,4841850,DFW - LUBBOCK,,41850
4841880,2,,057-919,057919,57919,0.4141,349451547,476,Sunnyvale ISD,Sunnyvale,Sunnyvale Independent School District,4841880,DFW,,41880
4841910,6,,171-902,171902,171902,0.5,2457447726,346,Sunray Collegiate ISD,Sunray Collegiate,Sunray Collegiate Independent School District,4841910,UNCATEGORIZED,,41910
4841970,5,,020-906,020906,20906,0.1517,87741361,27,Sweeny ISD,Sweeny,Sweeny Independent School District,4841970,HOUSTON,,41970
4842000,3,,143-905,143905,143905,0,1138587853,759,Sweet Home ISD,Sweet Home,Sweet Home Independent School District,4842000,SAN ANTONIO,,42000
4842030,5,,177-902,177902,177902,0.0818,970049586,363,Sweetwater ISD,Sweetwater,Sweetwater Independent School District,4842030,UNCATEGORIZED,,42030
4842060,2,,205-907,205907,205907,0.2682,186507820,267,Taft ISD,Taft,Taft Independent School District,4842060,CORPUS CHRISTI,,42060
4842090,4,,153-904,153904,153904,0.3105,947791472,59,Tahoka ISD,Tahoka,Tahoka Independent School District,4842090,DFW - LUBBOCK,,42090
4842120,2,,194-903,194903,194903,0.2167,355198522,134,Rivercrest ISD,Rivercrest,Rivercrest Independent School District,4842120,DFW,,42120
4842210,1,,146-907,146907,146907,0.0779,973253930,250,Tarkington ISD,Tarkington,Tarkington Independent School District,4842210,HOUSTON,,42210
4842240,2,,201-910,201910,201910,0.2922,2364378075,13,Tatum ISD,Tatum,Tatum Independent School District,4842240,DFW,,42240
4842280,1,C,246-911,246911,246911,0.3425,1024857308,981,Taylor ISD,Taylor,Taylor Independent School District,4842280,AUSTIN,1,42280
4842300,1,,081-904,081904,81904,0.2647,5494769931,175,Teague ISD,Teague,Teague Independent School District,4842300,DFW,,42300
4842330,2,P,014-909,014909,14909,0.3098,131152976,636,Temple ISD,Temple,Temple Independent School District,4842330,AUSTIN,,42330
4842360,1,,210-904,210904,210904,0.1481,166207042,219,Tenaha ISD,Tenaha,Tenaha Independent School District,4842360,DFW,,42360
4842390,4,,022-004,022004,22004,0,253081786,155,Terlingua CSD,Terlingua CSD,Terlingua Common School District,4842390,UNCATEGORIZED,,42390
4842420,5,,222-901,222901,222901,0.3707,2694656772,508,Terrell County ISD,Terrell County,Terrell County Independent School District,4842420,DFW,,42420
4842450,4,,129-906,129906,129906,0.3707,2694656772,840,Terrell ISD,Terrell,Terrell Independent School District,4842450,DFW,,42450
4842480,4,,019-907,019907,19907,0.255,6775675527,565,Texarkana ISD,Texarkana,Texarkana Independent School District,4842480,DFW,,42480
4842510,3,C,084-906,084906,84906,0.3684,158372881,573,Texas City ISD,Texas City,Texas City Independent School District,4842510,HOUSTON,2,42510
4842540,6,,211-901,211901,211901,0,221050818,23,Texhoma ISD,Texhoma,Texhoma Independent School District,4842540,UNCATEGORIZED,,42540
4842570,4,,056-902,056902,56902,0.0662,271964832,580,Texline ISD,Texline,Texline Independent School District,4842570,UNCATEGORIZED,,42570
4842630,4,,166-905,166905,166905,0,436699947,794,Thorndale ISD,Thorndale,Thorndale Independent School District,4842630,AUSTIN,,42630
4842660,7,P,246-912,246912,246912,0.3468,3430658595,796,Thrall ISD,Thrall,Thrall Independent School District,4842660,AUSTIN,,42660
4842690,7,p,149-902,149902,149902,0.0736,101902360,194,Three Rivers ISD,Three Rivers,Three Rivers Independent School District,4842690,SAN ANTONIO,,42690
4842720,6,,072-901,072901,72901,0,287310309,632,Three Way ISD,Three Way,Three Way Independent School District,4842720,DFW,,42720
4842780,5,,224-901,224901,224901,0,125461745,591,Throckmorton Collegiate ISD,Throckmorton Collegiate,Throckmorton Collegiate Independent School District,4842780,DFW - LUBBOCK,,42780
4842810,5,,158-902,158902,158902,0.1556,186112827,245,Tidehaven ISD,Tidehaven,Tidehaven Independent School District,4842810,HOUSTON,,42810
4842840,3,,210-905,210905,210905,0.2306,213699509,505,Timpson ISD,Timpson,Timpson Independent School District,4842840,DFW,,42840
4842870,3,,091-907,091907,91907,0.36,438318948,802,Tioga ISD,Tioga,Tioga Independent School District,4842870,DFW,,42870
4842900,3,,111-903,111903,111903,0.2816,403392455,628,Tolar ISD,Tolar,Tolar Independent School District,4842900,DFW,,42900
4842930,1,,091-918,091918,91918,0.1687,16041008244,729,Tom Bean ISD,Tom Bean,Tom Bean Independent School District,4842930,DFW,,42930
4842960,1,,101-921,101921,101921,0.376,90591678,600,Tomball ISD,Tomball,Tomball Independent School District,4842960,HOUSTON,,42960
4842990,1,,071-908,071908,71908,0.4689,239891417,908,Tornillo ISD,Tornillo,Tornillo Independent School District,4842990,UNCATEGORIZED,,42990
4843110,3,,221-905,221905,221905,0.18,61022845,453,Trent ISD,Trent,Trent Independent School District,4843110,DFW,,43110
4843140,5,,074-912,074912,74912,0.18,61022845,753,Trenton ISD,Trenton,Trenton Independent School District,4843140,DFW,,43140
4843170,6,,107-907,107907,107907,0.1967,550450346,613,Trinidad ISD,Trinidad,Trinidad Independent School District,4843170,DFW,,43170
4843200,5,,228-903,228903,228903,0.1817,542667897,416,Trinity ISD,Trinity,Trinity Independent School District,4843200,HOUSTON,,43200
4843230,1,,212-904,212904,212904,0.1012,739515749,706,Troup ISD,Troup,Troup Independent School District,4843230,DFW,,43230
4843260,1,,014-910,014910,14910,0.3133,233356494,779,Troy ISD,Troy,Troy Independent School District,4843260,AUSTIN,,43260
4843290,6,,001-908,001908,1908,0.2629,2329638758,534,Westwood ISD,Westwood,Westwood Independent School District,4843290,DFW,,43290
4843320,7,,219-903,219903,219903,0.2538,4235230147,348,Tulia ISD,Tulia,Tulia Independent School District,4843320,DFW - LUBBOCK,,43320
